{
  "$schema": "https://json-schema.org/draft/2020-12/schema",
  "$id": "https://speechrail.local/contracts/diarization/v1/completed.schema.json",
  "title": "SpeechRail extension-mode transcription completed event (SPK-E2E-1, version 1)",
  "description": "conversation.item.input_audio_transcription.completed as sent after speechrail.diarization.v1 negotiation: unique item_id, session-sample audio bounds, and NOT the attribution units. The text final is delivered before the slow aligner runs, so it carries status=pending (or not_applicable for an empty transcript) and an empty attribution_units array. Aligned units follow on a separate speechrail.alignment.done event and are then revised in place by speechrail.diarization.updated. Sample ranges are 16 kHz integer sample indexes in the SpeechRail session-global domain; text offsets are codepoint [start,end) ranges into the frozen transcript revision. Alignment units must partition the transcript with no gaps or overlaps (semantic rule; see contracts/realtime-openai.md).",
  "type": "object",
  "additionalProperties": false,
  "required": [
    "type",
    "event_version",
    "item_id",
    "content_index",
    "transcript",
    "audio_start_sample",
    "audio_end_sample",
    "attribution_units",
    "diagnostics"
  ],
  "properties": {
    "type": {"const": "conversation.item.input_audio_transcription.completed"},
    "event_version": {"const": 1},
    "item_id": {"type": "string", "minLength": 1, "maxLength": 128},
    "content_index": {"type": "integer", "minimum": 0},
    "transcript": {"type": "string"},
    "audio_start_sample": {"$ref": "#/$defs/sample"},
    "audio_end_sample": {"$ref": "#/$defs/sample"},
    "attribution_units": {
      "type": "array",
      "maxItems": 0,
      "description": "Always empty on the text final; the aligned units arrive on speechrail.alignment.done."
    },
    "diagnostics": {
      "type": "object",
      "additionalProperties": false,
      "required": ["alignment", "unit_count"],
      "properties": {
        "alignment": {
          "type": "object",
          "additionalProperties": false,
          "required": ["status", "reason"],
          "properties": {
            "status": {"enum": ["pending", "not_applicable"]},
            "reason": {"type": ["string", "null"], "minLength": 1}
          }
        },
        "unit_count": {"type": "integer", "minimum": 0}
      }
    }
  },
  "$defs": {
    "sample": {"type": "integer", "minimum": 0}
  }
}
