{
  "type": "conversation.item.input_audio_transcription.completed",
  "event_version": 1,
  "item_id": "item_example_2",
  "content_index": 0,
  "transcript": "同意。",
  "audio_start_sample": 48000,
  "audio_end_sample": 56000,
  "attribution_units": [],
  "diagnostics": {
    "alignment": {"status": "pending", "reason": null},
    "unit_count": 0
  }
}
